{
  "schema_version": "iosk.promotion.v1",
  "candidate_id": "safe-output-loop-docs-v1",
  "source": {
    "kind": "private_downstream",
    "description": "A private downstream adapter revealed a reusable pattern for promoting AI-assisted development output into public OSS."
  },
  "summary": "Document and test a privacy-safe promotion loop for turning useful private workflow output into public OSS artifacts.",
  "public_value": "Other OSS maintainers can use the same checklist to avoid leaking private context when publishing AI-assisted workflow improvements.",
  "output_artifacts": [
    {
      "type": "doc",
      "path": "docs/safe-output-promotion-loop.md"
    },
    {
      "type": "example",
      "path": "examples/promotion-candidate.json"
    },
    {
      "type": "test",
      "path": "tests/test_promotion.py"
    }
  ],
  "privacy_review": {
    "secrets_removed": true,
    "personal_data_removed": true,
    "local_paths_removed": true,
    "private_context_removed": true,
    "synthetic_example_used": true,
    "source_markers": []
  },
  "generalization": {
    "useful_to_other_maintainers": true,
    "private_names_removed": true,
    "can_be_tested_in_ci": true,
    "public_problem_statement": "AI-assisted development needs a safe output process for promoting private workflow findings into public OSS."
  },
  "review_evidence": {
    "reviewed_by_role": "maintainer",
    "checks": [
      {
        "id": "synthetic-example",
        "status": "passed",
        "evidence": "The candidate describes a synthetic workflow pattern and does not quote private records."
      },
      {
        "id": "public-artifacts",
        "status": "passed",
        "evidence": "All proposed artifacts are public docs, examples, or tests in this repository."
      },
      {
        "id": "side-effects",
        "status": "passed",
        "evidence": "The promotion check is report-only and does not create issues, releases, or external posts."
      }
    ]
  },
  "promotion_plan": {
    "target": "release",
    "maintainer_review": "Open a public issue, implement through PR, run CI, then release in the next tagged version.",
    "external_publish": false
  }
}
